{
  "schema_version": 1,
  "evidence_id": "capability-evidence:issue-229:v1",
  "issue": 229,
  "state": "accepted",
  "accepted_rung": "E2",
  "producer_commit": "73bf3996aa4577264dc34969692f6d273065dc52",
  "source_pr": 270,
  "accepted_by": "wangzitian0",
  "accepted_at": "2026-07-16T06:28:42Z",
  "commands": [
    "uv run pytest libs/contracts/tests/test_access.py -q",
    "uv run ruff check libs/contracts/src/truealpha_contracts/access.py libs/contracts/tests/test_access.py",
    "uv run mypy",
    "psql \"$DATABASE_URL\" -v ON_ERROR_STOP=1 -f db/tests/governed_research_access_contract.sql",
    "uv run pytest libs/runtime/tests/test_gate0_candidate.py libs/runtime/tests/test_delivery_governance.py -q",
    "uv run ruff check tools/check_gate0_candidate.py tools/check_delivery_governance.py libs/runtime/tests/test_gate0_candidate.py libs/runtime/tests/test_delivery_governance.py",
    "uv run python tools/check_gate0_candidate.py --manifest governance/gate0/manifest-v5.json",
    "uv run python tools/check_delivery_governance.py"
  ],
  "git_objects": [
    {
      "path": "init.md",
      "oid": "b784a7049efdb7872225b3542ffdcfa83d1d746c"
    },
    {
      "path": "libs/contracts/src/truealpha_contracts/access.py",
      "oid": "2181ca9d531d7701478be603a811e546a13ac428"
    },
    {
      "path": "libs/contracts/src/truealpha_contracts/__init__.py",
      "oid": "be1f3e9d7985e9b6f7230da86ceff01fd511153a"
    },
    {
      "path": "libs/contracts/tests/test_access.py",
      "oid": "7ce29da661104f4a390ce58b377056977363b1cf"
    },
    {
      "path": "governance/gate0/manifest-v5.json",
      "oid": "9093ef4f191f24546a2e9552b025b87080c6aab9"
    },
    {
      "path": "tools/check_gate0_candidate.py",
      "oid": "4f446bf1ec934be4346d0d85534210db0ea12064"
    },
    {
      "path": "tools/check_delivery_governance.py",
      "oid": "57edfb255f119c38e3447656e1515b1c6d2e27c6"
    }
  ],
  "attestation_ref": "https://github.com/wangzitian0/truealpha/pull/270",
  "claim_ceiling": "Accepted E2 Local/CI governed-research-access contract, authoritative architecture, stable exports, blocked Gate 0 v5 successor, and named-consumer handoff only; no Gate 0 acceptance, deployed identity, route, retention, replay, release, Staging, or Production claim",
  "residual_risks": [
    "#41 must publish its accepted stable mart-read handoff before MCP, report, or Web consumers can start",
    "#225, #226, and #227 still own conversation, document, and Web implementation design",
    "#66 and named product/legal owners still own deployed authentication, retention, deletion, export, privacy, and break-glass approval",
    "Gate 0 remains blocked on every inherited #59, #60, and #61 external attestation and evidence gap"
  ]
}
